{
  "claimed_contribution": [
    "The paper identifies elevated-viewpoint scenery as a situational antecedent of consumer risk taking.",
    "It proposes and tests illusory control as the mechanism linking elevated viewpoints to riskier choices.",
    "It specifies a boundary condition by showing that low-level processing of visual information attenuates the elevation effect."
  ],
  "context": "The studies are set in marketing-relevant visual environments where consumers encounter scenery images, including ad-like image exposure tasks and a U.S. convenience-store point-of-sale setting. Risk outcomes include chance-task betting, new-product purchase likelihood, insurance willingness to pay, and lottery-ticket spending.",
  "design_and_data": "The paper reports six studies (1a, 1b, 1c, 2, 3, and 4) that manipulate viewpoint elevation using scenery pictures taken from high versus low vertical positions. Samples include undergraduate students in laboratory tasks, MTurk adults in consumer-choice tasks, and a field sample of 913 convenience-store customers who purchased lottery tickets over 34 consecutive days. Study 2 measures perceived control and construal level to test mediation, and Study 3 uses a 3 x 2 design to manipulate processing level (high, neutral, low) as a moderator. Study 4 is a field experiment using high- versus low-elevation posters behind the sales counter and recorded lottery spending.",
  "focal_constructs": [
    "elevated viewpoint",
    "vertical position",
    "risk taking",
    "illusory sense of control",
    "perceived control",
    "mental construal level",
    "visual processing style"
  ],
  "main_findings": [
    "Exposure to high-elevation versus low-elevation scenery increased risk taking across multiple measures, including balloon pumping, new-product purchase likelihood, lower willingness to pay for insurance, and higher lottery-ticket spending in the field.",
    "Perceived illusory control was higher under elevated viewpoints and partially mediated the elevation effect on risk taking in the card-game study.",
    "Construal level did not reliably mediate the effect of elevation on risk taking, but low-level processing attenuated or eliminated the elevation effect relative to high-level or neutral processing."
  ],
  "one_line_summary": "Across six studies, viewing scenery from high versus low physical elevation increased consumer risk taking, largely via heightened illusory control, with attenuation under low-level visual processing.",
  "relation_to_prior_work": "extends prior work on consumer responses to visual stimuli by showing that vertical viewpoint in scenery images can shift risk behavior, and links this effect to perceived-control research by demonstrating a cue-based illusory-control pathway.",
  "research_gap": "The paper argues that despite the widespread use of pictures in marketing, evidence is limited on how visual landscape cues affect consumer cognition and behavior. It also notes that situational antecedents of risk taking are less studied than personal and decisional antecedents, and positions elevated-viewpoint scenery as an underexplored situational factor.",
  "research_question": "Does exposure to scenery viewed from a high versus low vertical position increase consumer risk taking? If so, is the effect explained by an illusory sense of control, and when is the effect weakened by how people process visual information?"
}